{"$schema":"http://json-schema.org/draft-07/schema#","title":"Starwind UI Configuration","description":"Configuration schema for Starwind UI components and settings","type":"object","properties":{"$schema":{"type":"string","description":"The schema the configuration adheres to","default":"https://starwind.dev/config-schema.json"},"tailwind":{"type":"object","description":"Tailwind CSS configuration settings","properties":{"css":{"type":"string","description":"Path to the Starwind CSS file","default":"src/styles/starwind.css"},"baseColor":{"type":"string","description":"Base color theme for the UI components","enum":["slate","gray","zinc","neutral","stone"],"default":"neutral"},"cssVariables":{"type":"boolean","description":"Whether to use CSS variables for theming. Currently only CSS variables are supported.","default":true}},"required":["css","baseColor","cssVariables"],"additionalProperties":false},"componentDir":{"type":"string","description":"Directory where Starwind UI components are located","default":"src/components"},"utilsDir":{"type":"string","description":"Directory where Starwind UI utilities are located","default":"src/lib/utils"},"components":{"type":"array","description":"List of Starwind UI components added to your project","items":{"type":"object","properties":{"name":{"type":"string","description":"Name of the component"},"version":{"type":"string","description":"Version of the component"}},"required":["name","version"],"additionalProperties":false},"default":[]}},"required":["tailwind","componentDir","components"],"additionalProperties":false}